{
  "$schema": "https://json-schema.org/draft/2020-12/schema", "title": "Sales order request", "type": "object", "additionalProperties": false,
  "required": ["schema_version", "tenant_external_id", "organization_external_id", "order_external_id", "sales_channel_external_id", "customer_external_id", "currency", "total_minor", "idempotency_key", "lines"],
  "properties": {
    "schema_version": {"const": "1.0"}, "tenant_external_id": {"type": "string", "minLength": 1}, "organization_external_id": {"type": "string", "minLength": 1}, "order_external_id": {"type": "string", "minLength": 1}, "sales_channel_external_id": {"type": "string", "minLength": 1}, "customer_external_id": {"type": "string", "minLength": 1}, "currency": {"type": "string", "pattern": "^[A-Z]{3}$"}, "total_minor": {"type": "integer", "minimum": 0}, "idempotency_key": {"type": "string", "minLength": 1},
    "lines": {"type": "array", "minItems": 1, "items": {"type": "object", "additionalProperties": false, "required": ["line_external_id", "item_external_id", "warehouse_external_id", "quantity", "unit_price_minor", "tax_amount_minor"], "properties": {"line_external_id": {"type": "string", "minLength": 1}, "item_external_id": {"type": "string", "minLength": 1}, "warehouse_external_id": {"type": "string", "minLength": 1}, "quantity": {"type": "number", "exclusiveMinimum": 0}, "unit_price_minor": {"type": "integer", "minimum": 0}, "tax_amount_minor": {"type": "integer", "minimum": 0}}}}
  }
}
