{"schema_version":"1.0","tenant_external_id":"customer-tenant-001","organization_external_id":"organization-001","order_external_id":"order-10001","sales_channel_external_id":"channel-online-a","customer_external_id":"customer-9001","currency":"INR","total_minor":125000,"idempotency_key":"sales-order:order-10001:v1","lines":[{"line_external_id":"line-1","item_external_id":"sku-1001","warehouse_external_id":"warehouse-main","quantity":2,"unit_price_minor":60000,"tax_amount_minor":5000}]}
